{
  "id": "flooring-B",
  "trade": "flooring",
  "direction": "B",
  "biz": {
    "name": "Twelve Mil Flooring",
    "short": "Twelve Mil",
    "initials": "TM",
    "slug": "twelve-mil-flooring",
    "owner": "Simone A.",
    "tradeLabel": "Flooring",
    "schemaType": "HomeAndConstructionBusiness",
    "phone": "(404) 555-0150",
    "phoneE164": "+14045550150",
    "sms": true,
    "email": "hello@twelve-mil-flooring.example",
    "city": "Atlanta",
    "state": "GA",
    "stateName": "Georgia",
    "timezone": "America/New_York",
    "areas": [
      "Decatur",
      "Smyrna",
      "Marietta",
      "Sandy Springs",
      "Brookhaven",
      "Tucker",
      "Dunwoody",
      "Roswell"
    ],
    "zips": [
      "30306",
      "30307",
      "30309",
      "30305",
      "30316",
      "30318",
      "30319",
      "30030",
      "30080",
      "30060",
      "30062",
      "30328",
      "30084",
      "30338",
      "30075"
    ],
    "hours": {
      "mon": [
        "07:30",
        "17:00"
      ],
      "tue": [
        "07:30",
        "17:00"
      ],
      "wed": [
        "07:30",
        "17:00"
      ],
      "thu": [
        "07:30",
        "17:00"
      ],
      "fri": [
        "07:30",
        "16:00"
      ],
      "sat": [
        "09:00",
        "12:00"
      ],
      "sun": null
    },
    "emergency": false,
    "familyOwned": false
  },
  "services": [
    {
      "name": "Luxury vinyl plank",
      "short": "Vinyl plank",
      "blurb": "Waterproof plank with the wear layer printed on your quote, so you know what you are buying."
    },
    {
      "name": "Engineered hardwood",
      "short": "Engineered wood",
      "blurb": "Real wood top layer over a stable core, glued or floated over slabs and upstairs alike."
    },
    {
      "name": "Solid hardwood",
      "short": "Solid hardwood",
      "blurb": "Nail-down solid oak for wood subfloors, sanded and finished in place."
    },
    {
      "name": "Tile & stone floors",
      "short": "Tile",
      "blurb": "Porcelain and stone set flat over a membrane in kitchens, baths and mudrooms."
    },
    {
      "name": "Slab moisture testing",
      "short": "Moisture test",
      "blurb": "We read the moisture in your slab before any floor goes down, and show you the number."
    },
    {
      "name": "Floor leveling",
      "short": "Leveling",
      "blurb": "Dips and humps ground or filled so long planks lie flat and do not click or bounce."
    },
    {
      "name": "Carpet for bedrooms",
      "short": "Carpet",
      "blurb": "Bedroom and stair carpet with the pad weight listed, stretched tight with seams out of the walkway."
    },
    {
      "name": "Hardwood refinishing",
      "short": "Refinishing",
      "blurb": "Scratched or gray hardwood sanded to bare wood and refinished in the color you pick."
    },
    {
      "name": "Stairs",
      "short": "Stairs",
      "blurb": "Treads, risers and nosings in wood or vinyl to match the floor at the top of the stairs."
    },
    {
      "name": "Samples at your house",
      "short": "Samples",
      "blurb": "We bring the samples to your rooms and lay them in your own light before you choose."
    }
  ],
  "proof": {
    "label": "Sample",
    "rating": 4.8,
    "reviewCount": 231,
    "reviews": [
      {
        "text": "I had three vinyl quotes and no way to compare them. Simone wrote the wear layer and thickness next to each one, and the cheap one turned out to be half as thick. Went with the 12 mil.",
        "name": "Danielle P.",
        "town": "Decatur",
        "service": "Luxury vinyl plank",
        "stars": 5
      },
      {
        "text": "They tested our basement slab before quoting and the reading was too high for the wood I wanted. Engineered on a moisture barrier instead. Two summers in and no cupping.",
        "name": "Kevin O.",
        "town": "Smyrna",
        "service": "Slab moisture testing",
        "stars": 5
      },
      {
        "text": "Our 1960s ranch had a dip in the hallway you could feel in socks. They ground and filled it before the plank went down. Nothing clicks underfoot now.",
        "name": "Gloria T.",
        "town": "Tucker",
        "service": "Floor leveling",
        "stars": 5
      },
      {
        "text": "Brought samples to the house and laid them by the big window at four in the afternoon. The gray I loved in the store looked green in our light. Glad we checked.",
        "name": "Nate H.",
        "town": "Brookhaven",
        "service": "Samples at your house",
        "stars": 5
      },
      {
        "text": "Bathroom tile is flat and the grout lines run straight out the door into the hall. They showed me the membrane under it before setting a single tile.",
        "name": "Imani J.",
        "town": "Marietta",
        "service": "Tile & stone floors",
        "stars": 4
      },
      {
        "text": "Refinished the oak in our Kirkwood bungalow. They told me which boards were too thin to sand again and replaced those first. It looks like the house finally got a haircut.",
        "name": "Chris L.",
        "town": "Atlanta",
        "service": "Hardwood refinishing",
        "stars": 5
      },
      {
        "text": "Carpet in three bedrooms, pad weight written on the quote, seams nowhere near the doorways. The installers took the old carpet with them and vacuumed.",
        "name": "Ruth M.",
        "town": "Dunwoody",
        "service": "Carpet for bedrooms",
        "stars": 5
      }
    ],
    "guarantee": "If a plank or tile we laid lifts, gaps or cracks in 2 years, we replace it and pay the labor.",
    "license": "SAMPLE-GA-24917",
    "insured": true,
    "years": 12,
    "prices": [
      {
        "item": "Luxury vinyl plank, installed",
        "from": "$4",
        "to": "$8",
        "unit": "per sq ft",
        "note": "wear layer on the quote"
      },
      {
        "item": "Engineered hardwood, installed",
        "from": "$8",
        "to": "$14",
        "unit": "per sq ft"
      },
      {
        "item": "Tile floor, installed",
        "from": "$11",
        "to": "$22",
        "unit": "per sq ft",
        "note": "membrane included"
      },
      {
        "item": "Floor leveling",
        "from": "$2",
        "to": "$5",
        "unit": "per sq ft",
        "note": "only where it is needed"
      },
      {
        "item": "Carpet with pad",
        "from": "$3",
        "to": "$7",
        "unit": "per sq ft"
      },
      {
        "item": "Hardwood refinishing",
        "from": "$3",
        "to": "$6",
        "unit": "per sq ft"
      }
    ]
  },
  "seo": {
    "title": "Flooring Installation in Atlanta, GA | Twelve Mil Flooring",
    "description": "Atlanta flooring with the specs shown: wear layer, thickness, slab moisture and sample prices per square foot. Compare floors, measure a room, then call."
  },
  "demo": {
    "disclaimer": "Sample website by Site Sledge. Business details are illustrative."
  }
}
