{
  "id": "pinestraw-C",
  "trade": "pinestraw",
  "direction": "C",
  "biz": {
    "name": "Two Seasons Pine Straw",
    "short": "Two Seasons",
    "initials": "TS",
    "slug": "two-seasons-straw",
    "owner": "Corinne",
    "tradeLabel": "Pine Straw",
    "schemaType": "HomeAndConstructionBusiness",
    "phone": "(770) 555-0136",
    "phoneE164": "+17705550136",
    "sms": true,
    "email": "hello@two-seasons-straw.example",
    "city": "Marietta",
    "state": "GA",
    "stateName": "Georgia",
    "timezone": "America/New_York",
    "areas": ["Kennesaw", "Smyrna", "Acworth", "Powder Springs", "Roswell", "Austell", "Mableton"],
    "zips": ["30060", "30062", "30064", "30066", "30067", "30068", "30144", "30080"],
    "hours": {
      "mon": ["08:00", "18:00"], "tue": ["08:00", "18:00"], "wed": ["08:00", "18:00"],
      "thu": ["08:00", "18:00"], "fri": ["08:00", "17:00"], "sat": ["08:00", "14:00"], "sun": null
    },
    "emergency": false,
    "familyOwned": false
  },
  "services": [
    { "name": "Spring pine straw refresh", "short": "Spring refresh", "blurb": "New straw down when the dogwoods open, in time for spring HOA walk-throughs." },
    { "name": "Fall pine straw refresh", "short": "Fall refresh", "blurb": "Leaves cleared and beds topped off after the oaks drop, before Thanksgiving company." },
    { "name": "Pine straw installation", "short": "Installation", "blurb": "Beds edged, weeded and covered in long-leaf straw over the red clay." },
    { "name": "HOA and common-area beds", "short": "HOA beds", "blurb": "Entrance beds, islands and common areas done on one scheduled day per neighborhood." },
    { "name": "Leaf removal", "short": "Leaves", "blurb": "Oak and maple leaves blown from beds, lawn and walks, then hauled away." },
    { "name": "Shrub trimming", "short": "Shrubs", "blurb": "Hollies, boxwoods and loropetalum cut back after bloom so the beds read clean." },
    { "name": "Bed edging", "short": "Edging", "blurb": "Curved bed lines recut each season so the clay does not creep into the lawn." },
    { "name": "Annual programs", "short": "Two-season plan", "blurb": "Both refreshes booked a year ahead, same week each spring and each fall." }
  ],
  "proof": {
    "label": "Sample",
    "rating": 4.9,
    "reviewCount": 213,
    "reviews": [
      { "text": "Our HOA walk-through is the second week of April, every year. Corinne's crew has us on the calendar for the week before, so I stopped thinking about it.", "name": "Leanne V.", "town": "Marietta", "service": "Annual programs" },
      { "text": "We back up to the woods off Barnes Mill and get buried in oak leaves. The fall visit cleared all of it out of the beds and put fresh straw down the same afternoon. The yard looked ready for company.", "name": "Hugh M.", "town": "Marietta", "service": "Fall pine straw refresh" },
      { "text": "I manage the common areas for our subdivision. Fourteen beds at the entrance and two islands, done on a Tuesday with no residents complaining about trucks in the road.", "name": "Bev O.", "town": "Kennesaw", "service": "HOA and common-area beds" },
      { "text": "The red clay had crept two feet into the lawn on one side. They recut the curve where it used to be and the straw sits right up to it now.", "name": "Tobias L.", "town": "Smyrna", "service": "Bed edging" },
      { "text": "Spring refresh while the azaleas were blooming. They worked around every bush without knocking off a single flower, which I was honestly worried about.", "name": "Rhoda E.", "town": "Acworth", "service": "Spring pine straw refresh" },
      { "text": "Good people, on time, and the straw was a deep red-brown, not the faded stuff. We have used them three springs in a row.", "name": "Darius K.", "town": "Powder Springs", "service": "Pine straw installation" }
    ],
    "guarantee": "If your HOA flags a bed we spread, we fix it before your deadline.",
    "license": "SAMPLE-GA-TS5106",
    "insured": true,
    "years": 14,
    "prices": [
      { "item": "Pine straw installed", "from": "$7", "to": "$10", "unit": "per bale", "note": "long-leaf, edged and weeded" },
      { "item": "Spring or fall refresh", "from": "$350", "to": "$700", "note": "typical Cobb front and back beds" },
      { "item": "Two-season plan", "from": "$650", "to": "$1,300", "note": "spring and fall, booked ahead" },
      { "item": "Leaf removal", "from": "$150", "to": "$450", "note": "beds and lawn, hauled away" },
      { "item": "HOA common-area round", "from": "$900", "to": "$3,500", "note": "entrances and islands, per visit" }
    ]
  },
  "seo": {
    "title": "Pine Straw Installation in Marietta, GA | Two Seasons",
    "description": "Marietta pine straw twice a year: spring refresh when the dogwoods open, fall refresh before Thanksgiving. HOA beds, edging and leaves. Call or text."
  },
  "demo": {
    "disclaimer": "Sample website by Site Sledge. Business details are illustrative."
  }
}
