{
  "id": "pinestraw-A",
  "trade": "pinestraw",
  "direction": "A",
  "biz": {
    "name": "Tuck & Rake Pine Straw",
    "short": "Tuck & Rake",
    "initials": "T&R",
    "slug": "tuck-and-rake",
    "owner": "Royce H.",
    "tradeLabel": "Pine Straw",
    "schemaType": "HomeAndConstructionBusiness",
    "phone": "(251) 555-0134",
    "phoneE164": "+12515550134",
    "sms": true,
    "email": "hello@tuck-and-rake.example",
    "city": "Mobile",
    "state": "AL",
    "stateName": "Alabama",
    "timezone": "America/Chicago",
    "areas": ["Daphne", "Fairhope", "Spanish Fort", "Saraland", "Semmes", "Theodore", "Satsuma"],
    "zips": ["36604", "36606", "36608", "36609", "36695", "36526", "36532", "36527"],
    "hours": {
      "mon": ["07:00", "17:00"], "tue": ["07:00", "17:00"], "wed": ["07:00", "17:00"],
      "thu": ["07:00", "17:00"], "fri": ["07:00", "17:00"], "sat": ["07:30", "12:00"], "sun": null
    },
    "emergency": false,
    "familyOwned": false
  },
  "services": [
    { "name": "Pine straw installation", "short": "Installation", "blurb": "Old straw raked out, beds edged and weeded, new straw spread and tucked at the edge." },
    { "name": "Long-leaf pine straw", "short": "Long-leaf straw", "blurb": "Long needles that knit together and stay on a slope through a hard Gulf rain." },
    { "name": "Bed edging", "short": "Edging", "blurb": "A spade-cut line between lawn and bed so the straw has something to lock against." },
    { "name": "Bed cleanup and weeding", "short": "Cleanup", "blurb": "Weeds pulled by the root and old gray straw hauled off before anything new goes down." },
    { "name": "Washout re-tuck", "short": "Washout re-tuck", "blurb": "Straw that slid off a slope after a storm raked back up and tucked deeper." },
    { "name": "Seasonal refresh", "short": "Refresh", "blurb": "A top layer over last season's straw when the beds have gone gray but still hold." },
    { "name": "Mulch installation", "short": "Mulch", "blurb": "Hardwood mulch for beds by the pool, the door or anywhere you want darker color." },
    { "name": "Shrub trimming", "short": "Shrubs", "blurb": "Azaleas, boxwoods and hollies shaped before the straw goes under them, clippings hauled off." },
    { "name": "Leaf removal", "short": "Leaves", "blurb": "Oak leaves blown out of the beds and off the lawn so new straw is not buried." }
  ],
  "proof": {
    "label": "Sample",
    "rating": 4.9,
    "reviewCount": 86,
    "reviews": [
      { "text": "We get water off the whole roof running down one side of the yard. Every spring the straw ended up at the curb. They cut a deep edge, tucked the low side and it was still there after that big May storm.", "name": "Earline D.", "town": "Mobile", "service": "Washout re-tuck" },
      { "text": "They raked out three years of old flat straw before putting anything down. I did not know there was that much under there. The beds look twice as deep now.", "name": "Boyd W.", "town": "Daphne", "service": "Pine straw installation" },
      { "text": "Booked a fall refresh for Thanksgiving. Quick and neat, the driveway was blown off, nothing stuck in the boxwoods, and the straw was a good deep red.", "name": "Nan G.", "town": "Fairhope", "service": "Seasonal refresh" },
      { "text": "The edge is what sold me. My yard man used to just dump straw on top of the grass line. Royce's crew cut a clean curve around the oak and the straw sits inside it like it was poured in.", "name": "Cecil R.", "town": "Spanish Fort", "service": "Bed edging" },
      { "text": "Got my azaleas trimmed and the beds weeded in the same visit. They told me which weeds were coming back from runners and pulled those out by the root instead of covering them.", "name": "Marla J.", "town": "Semmes", "service": "Bed cleanup and weeding" },
      { "text": "Texted a photo of my beds on Monday, had a bale count back that afternoon and the crew was here Thursday morning at seven like they said.", "name": "Dewayne P.", "town": "Saraland", "service": "Pine straw installation" }
    ],
    "guarantee": "If rain moves straw off a slope we tucked within 30 days, we come back and re-tuck it at no charge.",
    "license": "SAMPLE-AL-PS2714",
    "insured": true,
    "years": 11,
    "prices": [
      { "item": "Pine straw installed", "from": "$6", "to": "$9", "unit": "per bale", "note": "long-leaf, spread and tucked" },
      { "item": "Front-yard refresh", "from": "$280", "to": "$520", "note": "about 40-60 bales, edging included" },
      { "item": "Bed cleanup and weeding", "from": "$120", "to": "$380", "note": "depends on how long it has gone" },
      { "item": "Bed edging", "from": "$1", "to": "$3", "unit": "per linear foot", "note": "spade-cut line" },
      { "item": "Washout re-tuck", "from": "$95", "to": "$240", "note": "one slope or side yard" }
    ]
  },
  "seo": {
    "title": "Pine Straw Installation in Mobile, AL | Tuck & Rake",
    "description": "Mobile pine straw installation done in order: old straw raked out, beds edged and weeded, long-leaf straw tucked so rain can't move it. Call or text."
  },
  "demo": {
    "disclaimer": "Sample website by Site Sledge. Business details are illustrative."
  }
}
