{
  "id": "mechanic-A",
  "trade": "mechanic",
  "direction": "A",
  "biz": {
    "name": "Line Item Auto Repair",
    "short": "Line Item",
    "initials": "LI",
    "slug": "line-item",
    "owner": "Renee D.",
    "tradeLabel": "Auto Repair & Diagnosis",
    "schemaType": "AutoRepair",
    "phone": "(517) 555-0185",
    "phoneE164": "+15175550185",
    "sms": true,
    "email": "hello@line-item.example",
    "city": "Lansing",
    "state": "MI",
    "stateName": "Michigan",
    "timezone": "America/Detroit",
    "areas": ["East Lansing", "Okemos", "Holt", "Mason", "Haslett", "DeWitt", "Grand Ledge"],
    "zips": ["48906", "48910", "48911", "48912", "48915", "48917", "48823", "48864", "48842", "48854", "48840", "48820", "48837"],
    "hours": {
      "mon": ["07:30", "17:30"], "tue": ["07:30", "17:30"], "wed": ["07:30", "17:30"],
      "thu": ["07:30", "17:30"], "fri": ["07:30", "17:30"], "sat": ["08:00", "12:00"], "sun": null
    },
    "emergency": false
  },
  "services": [
    { "name": "Check engine light diagnosis", "short": "Check engine", "blurb": "We read the code, then test until we know the cause, and call you before fixing anything." },
    { "name": "Brake repair", "short": "Brakes", "blurb": "Pads, rotors, calipers and rusted brake lines, measured and photographed so you see the wear." },
    { "name": "Suspension and steering", "short": "Suspension", "blurb": "Clunks over potholes traced to the link, joint or strut that is worn, and nothing else." },
    { "name": "Starting and charging", "short": "Battery & charging", "blurb": "Battery, alternator and starter tested on the car before any part gets swapped." },
    { "name": "Cooling system repair", "short": "Overheating", "blurb": "Running hot in traffic? Thermostat, water pump, radiator and hoses checked under pressure." },
    { "name": "Exhaust and muffler", "short": "Exhaust", "blurb": "Salt-rotted pipes, hangers and mufflers patched where it makes sense, replaced where it doesn't." },
    { "name": "A/C repair", "short": "A/C", "blurb": "Warm vents traced with a leak test first, not a guess and a can of refrigerant." },
    { "name": "Pre-purchase inspection", "short": "Used car check", "blurb": "A used car checked on the lift before you pay, with a written list of what we found." },
    { "name": "Timing belt and water pump", "short": "Timing belts", "blurb": "Done on schedule with the pump and tensioner, so the engine isn't opened up twice." }
  ],
  "proof": {
    "label": "Sample",
    "rating": 4.8,
    "reviewCount": 341,
    "reviews": [
      { "text": "I dropped the car off at seven thirty and Renee texted at ten with a photo of the front pads and the rotor. She said the rear brakes had a while left and to leave them. Picked it up by four.", "name": "Tasha W.", "town": "Holt", "service": "Brake repair" },
      { "text": "Another shop wanted to replace three sensors for the check engine light. These guys found a cracked vacuum hose, charged me for the hose and the diagnosis, and the light has stayed off.", "name": "Omar K.", "town": "East Lansing", "service": "Check engine light diagnosis" },
      { "text": "The clunk after the March potholes was a sway bar link, one side only. They showed me the play in it on the lift and didn't touch the struts.", "name": "Becky L.", "town": "Okemos", "service": "Suspension and steering" },
      { "text": "Bought my daughter's first car from a guy in Mason. They put it on the lift the day before and found a brake line rusted nearly through. We talked the price down by the cost of the repair.", "name": "Jerome P.", "town": "Mason", "service": "Pre-purchase inspection" },
      { "text": "My battery died twice in a week. They tested it, then found the trunk light staying on. New bulb switch, kept the battery. I appreciated being told the cheap answer first.", "name": "Hailey S.", "town": "Lansing", "service": "Starting and charging" },
      { "text": "The temperature gauge kept climbing on my commute. They pressure-tested the system, found the water pump weeping, and called with the price before ordering it. Ready the next afternoon.", "name": "Doug F.", "town": "DeWitt", "service": "Cooling system repair" },
      { "text": "My exhaust sounded like a tractor. They welded in a new section instead of selling me the whole system, and sent a photo of the rotted pipe they cut out.", "name": "Ana R.", "town": "Grand Ledge", "service": "Exhaust and muffler" }
    ],
    "guarantee": "Nothing is repaired until we call you with a photo, a price and your yes.",
    "license": "SAMPLE-MI-RF-30871",
    "insured": true,
    "years": 14,
    "prices": [
      { "item": "Diagnostic check", "from": "$95", "to": "$160", "note": "applied to the repair if you go ahead" },
      { "item": "Front brake pads and rotors", "from": "$320", "to": "$600", "note": "most cars and small SUVs" },
      { "item": "Battery replacement", "from": "$160", "to": "$300", "note": "tested first, installed" },
      { "item": "Pre-purchase inspection", "from": "$120", "to": "$180", "note": "on the lift, written list" },
      { "item": "Timing belt with water pump", "from": "$650", "to": "$1,200", "note": "depends on the engine" }
    ]
  },
  "seo": {
    "title": "Auto Repair & Diagnosis in Lansing, MI | Line Item Auto",
    "description": "Lansing auto repair by appointment: brakes, check engine lights, suspension and more. We call with a photo and a price before any work is done."
  },
  "demo": {
    "disclaimer": "Sample website by Site Sledge. Business details are illustrative."
  }
}
