{
  "id": "hvac-C",
  "trade": "hvac",
  "direction": "C",
  "biz": {
    "name": "Shadeline Heating & Cooling",
    "short": "Shadeline",
    "initials": "SHC",
    "slug": "shadeline-heating-and-cooling",
    "owner": "Nico",
    "tradeLabel": "Heating & Cooling",
    "schemaType": "HVACBusiness",
    "phone": "(602) 555-0106",
    "phoneE164": "+16025550106",
    "sms": true,
    "email": "hello@shadeline-heating-and-cooling.example",
    "city": "Phoenix",
    "state": "AZ",
    "stateName": "Arizona",
    "timezone": "America/Phoenix",
    "areas": ["Tempe", "Glendale", "Chandler", "Peoria", "Paradise Valley", "Gilbert"],
    "zips": ["85004", "85006", "85012", "85014", "85016", "85018", "85020", "85028", "85044", "85281", "85282", "85301", "85224", "85345", "85253"],
    "hours": {
      "mon": ["05:30", "19:00"], "tue": ["05:30", "19:00"], "wed": ["05:30", "19:00"],
      "thu": ["05:30", "19:00"], "fri": ["05:30", "19:00"], "sat": ["06:00", "16:00"], "sun": ["07:00", "13:00"]
    },
    "emergency": true,
    "familyOwned": true
  },
  "services": [
    { "name": "AC repair", "short": "AC repair", "blurb": "No-cool calls run early, before the roof and the attic turn into an oven." },
    { "name": "Rooftop package unit replacement", "short": "Rooftop units", "blurb": "Old rooftop units craned off flat roofs and replaced, with the curb and seals redone." },
    { "name": "Heat pump installation", "short": "Heat pumps", "blurb": "Heat pumps sized for 115° afternoons, with the coil placed away from the west wall." },
    { "name": "Monsoon storm check", "short": "Storm check", "blurb": "After dust and lightning: coils rinsed, breakers and surge parts tested, drains cleared." },
    { "name": "Rental AC checks", "short": "Rental checks", "blurb": "Rental homes tested against the city's rule that AC must cool to 82° or below." },
    { "name": "Condenser coil cleaning", "short": "Coil cleaning", "blurb": "Dust and cottonwood fluff washed out of the coil so the unit sheds heat again." },
    { "name": "Ductless mini-splits", "short": "Ductless", "blurb": "Wall units for Arizona rooms, garages and casitas that a rooftop system never cools." },
    { "name": "Duct repair on flat roofs", "short": "Roof ducts", "blurb": "Sun-cracked rooftop duct jackets resealed and rewrapped before they bake again." },
    { "name": "Heat repair", "short": "Heat repair", "blurb": "Heat strips and gas packs checked for the handful of cold desert nights each winter." }
  ],
  "proof": {
    "label": "Sample",
    "rating": 4.9,
    "reviewCount": 389,
    "reviews": [
      { "text": "Nico's crew was on our roof at 5:45 in the morning, done before it hit 100. Old package unit out by crane, new one set, and the curb sealed so the ceiling stays dry in monsoon.", "name": "Teresa V.", "town": "Glendale", "service": "Rooftop package unit replacement", "stars": 5 },
      { "text": "After the haboob the unit was running but the air was barely cool. The coil was caked brown. They washed it out and the supply air dropped almost 15 degrees.", "name": "Omar F.", "town": "Tempe", "service": "Condenser coil cleaning", "stars": 5 },
      { "text": "I rent out two houses in Chandler. They tested both against the 82 degree rule, wrote down the numbers, and flagged a duct that was pulling attic air. Tenants stopped calling me.", "name": "Linda H.", "town": "Chandler", "service": "Rental AC checks", "stars": 5 },
      { "text": "Lightning took out something on our AC in August. They checked the contactor, capacitor and the surge protector, replaced two parts, and walked me through why the breaker kept tripping.", "name": "Ben W.", "town": "Peoria", "service": "Monsoon storm check", "stars": 5 },
      { "text": "Our Arizona room was useless in summer. The ductless unit went in on a Tuesday and now it's where we eat dinner. Lines are covered neatly along the stucco.", "name": "Carmen L.", "town": "Gilbert", "service": "Ductless mini-splits", "stars": 5 },
      { "text": "The day they came was the hottest of the week and the earliest slot was already gone, so we waited until the next morning. Once here, fast and tidy, and the price matched the text.", "name": "Hugh D.", "town": "Paradise Valley", "service": "AC repair", "stars": 4 }
    ],
    "years": 22,
    "prices": [
      { "item": "Diagnostic visit", "from": "$89", "to": "$160", "note": "credited if you go ahead with the repair" },
      { "item": "Capacitor replacement", "from": "$180", "to": "$450", "note": "part and labor" },
      { "item": "Monsoon storm check", "from": "$129", "to": "$219", "note": "parts extra if needed" },
      { "item": "Rooftop package unit", "from": "$11,000", "to": "$18,000", "note": "replacement, crane included" },
      { "item": "Ductless mini-split, one zone", "from": "$3,800", "to": "$6,800", "note": "installed" }
    ]
  },
  "seo": {
    "title": "Phoenix AC Repair & Rooftop Units | Shadeline Cooling",
    "description": "Phoenix AC repair and rooftop unit replacement on early-morning schedules, plus monsoon storm checks in Tempe, Glendale, Chandler and Peoria."
  },
  "demo": {
    "disclaimer": "Sample website by Site Sledge. Business details are illustrative."
  }
}
