{
  "id": "septic-B",
  "trade": "septic",
  "direction": "B",
  "biz": {
    "name": "Gallon Count Septic",
    "short": "Gallon Count",
    "initials": "GC",
    "slug": "gallon-count-septic",
    "owner": "Wanda S.",
    "tradeLabel": "Septic",
    "schemaType": "HomeAndConstructionBusiness",
    "phone": "(270) 555-0123",
    "phoneE164": "+12705550123",
    "sms": true,
    "email": "hello@gallon-count-septic.example",
    "city": "Bowling Green",
    "state": "KY",
    "stateName": "Kentucky",
    "timezone": "America/Chicago",
    "areas": ["Smiths Grove", "Alvaton", "Rockfield", "Woodburn", "Oakland", "Franklin"],
    "zips": ["42101", "42103", "42104", "42171", "42122", "42274", "42170", "42159", "42134"],
    "hours": {
      "mon": ["07:30", "17:00"], "tue": ["07:30", "17:00"], "wed": ["07:30", "17:00"],
      "thu": ["07:30", "17:00"], "fri": ["07:30", "16:00"], "sat": null, "sun": null
    },
    "emergency": false,
    "familyOwned": false
  },
  "services": [
    { "name": "Septic tank pumping", "short": "Pumping", "blurb": "Every pump-out logs gallons removed, sludge and scum depth, and the date you are next due." },
    { "name": "Septic inspections", "short": "Inspections", "blurb": "A printed report with readings for the tank, baffles, distribution box and each field line." },
    { "name": "Real estate inspections", "short": "Home sale reports", "blurb": "Buyer or seller reports with photos and readings, timed to your closing date." },
    { "name": "Tank locating", "short": "Locating", "blurb": "Lids found with a probe and a locator, then marked and measured from the house." },
    { "name": "Drain field evaluation and repair", "short": "Drain fields", "blurb": "Field lines probed and tested, with repairs planned around shallow rock and sinkholes." },
    { "name": "Pump and alarm repair", "short": "Pumps & alarms", "blurb": "Pump tanks, floats and high-water alarms tested and fixed, with the readings noted." },
    { "name": "Riser and lid installation", "short": "Risers", "blurb": "Lids brought up to the surface so future checks take minutes, not shovels." },
    { "name": "Maintenance plans", "short": "Maintenance plans", "blurb": "Pump-outs scheduled by your household size and tank gallons, with a reminder before each one." },
    { "name": "New septic installation", "short": "New systems", "blurb": "Systems sized from the soil test and bedroom count for new homes and failed fields." }
  ],
  "proof": {
    "label": "Sample",
    "rating": 4.9,
    "reviewCount": 212,
    "reviews": [
      { "text": "The report listed every reading: 1,000 gallon tank, 15 inches of sludge, outlet baffle sound. It said our family of five should pump every three years, and the reminder card showed up right on time.", "name": "Brandi W.", "town": "Bowling Green", "service": "Septic tank pumping", "stars": 5 },
      { "text": "Buying a farmhouse outside Smiths Grove with no records at all. Their inspection found the tank, mapped three field lines and flagged a cracked lid. We negotiated the fix into the price.", "name": "Tyler M.", "town": "Smiths Grove", "service": "Real estate inspections", "stars": 5 },
      { "text": "Alarm went off on a Sunday night. Wanda talked me through the breaker over the phone and had someone out Monday morning to replace the float. Small part, clear bill.", "name": "Lorene D.", "town": "Alvaton", "service": "Pump and alarm repair", "stars": 5 },
      { "text": "One field line was wet at the low end. They probed every line, found it sat on rock and rerouted that run instead of replacing the whole field. They showed me the numbers before starting anything.", "name": "Wendell C.", "town": "Rockfield", "service": "Drain field evaluation and repair", "stars": 5 },
      { "text": "I like knowing what I'm paying for. The plan sets our pump-out by people and gallons, not guesswork, and each visit comes with the same printed sheet so I can compare years.", "name": "Jeanette F.", "town": "Woodburn", "service": "Maintenance plans", "stars": 5 },
      { "text": "Found our lids in an hour and marked them on a drawing with distances from the back corner of the house. The drawing is taped inside the utility closet now.", "name": "Roy G.", "town": "Oakland", "service": "Tank locating", "stars": 4 },
      { "text": "New build on a lot in Simpson County. They explained the soil test, the tank size for four bedrooms and why the field went where it did. Passed county inspection the first time.", "name": "Kristy H.", "town": "Franklin", "service": "New septic installation", "stars": 5 }
    ],
    "guarantee": "If a field line we repaired ponds within one year, we dig it back up and redo it at our cost.",
    "license": "SAMPLE-KY-27719",
    "insured": true,
    "years": 19,
    "prices": [
      { "item": "Septic tank pumping", "from": "$300", "to": "$500", "note": "1,000 to 1,500 gallon tank" },
      { "item": "Real estate inspection", "from": "$450", "to": "$750", "note": "includes pump-out and written report" },
      { "item": "Tank locating", "from": "$125", "to": "$275", "note": "probe, locator and marked drawing" },
      { "item": "Pump and alarm repair", "from": "$250", "to": "$1,200", "note": "float swap up to a new effluent pump" },
      { "item": "Drain field replacement", "from": "$6,000", "to": "$18,000", "note": "depends on soil, rock and field size" }
    ]
  },
  "seo": {
    "title": "Septic Pumping in Bowling Green, KY | Gallon Count Septic",
    "description": "Bowling Green septic pumping, inspections and drain field repair, with every reading on a printed report. Check when your tank is due, then call or book."
  },
  "demo": {
    "disclaimer": "Sample website by Site Sledge. Business details are illustrative."
  }
}
