{
  "id": "windowdoor-B",
  "trade": "windowdoor",
  "direction": "B",
  "biz": {
    "name": "Shutterless Window & Door",
    "short": "Shutterless",
    "initials": "SW",
    "slug": "shutterless-window-door",
    "owner": "Victor A.",
    "tradeLabel": "Window & Door Installer",
    "schemaType": "HomeAndConstructionBusiness",
    "phone": "(239) 555-0144",
    "phoneE164": "+12395550144",
    "sms": true,
    "email": "hello@shutterless-window-door.example",
    "city": "Naples",
    "state": "FL",
    "stateName": "Florida",
    "timezone": "America/New_York",
    "areas": ["Marco Island", "Bonita Springs", "Estero", "Golden Gate", "Pelican Bay", "North Naples"],
    "zips": ["34102", "34103", "34104", "34105", "34108", "34109", "34110", "34112", "34113", "34116", "34119", "34120", "34145", "34134", "33928"],
    "hours": {
      "mon": ["08:00", "17:00"], "tue": ["08:00", "17:00"], "wed": ["08:00", "17:00"],
      "thu": ["08:00", "17:00"], "fri": ["08:00", "17:00"], "sat": null, "sun": null
    },
    "emergency": false,
    "familyOwned": false
  },
  "services": [
    { "name": "Impact window replacement", "short": "Impact windows", "blurb": "Windows chosen by their label: design pressure, missile level, U-factor and SHGC explained for your house." },
    { "name": "Impact sliding glass doors", "short": "Impact sliders", "blurb": "Large lanai sliders with the pressure rating your wall needs and rollers that glide." },
    { "name": "Impact French doors", "short": "French doors", "blurb": "Swinging impact doors to the pool deck, with multi-point locks and sealed sills." },
    { "name": "Entry doors", "short": "Entry doors", "blurb": "Impact entry doors and sidelights, with the product label shown to you before ordering." },
    { "name": "Shutter to impact glass", "short": "Shutters to impact", "blurb": "Panels, accordions or roll-downs replaced by glass, compared honestly with keeping the shutters." },
    { "name": "Condo window projects", "short": "Condo windows", "blurb": "Paperwork for the board, matched specs per unit and install days planned with management." },
    { "name": "Slider rollers and tracks", "short": "Slider repair", "blurb": "Hard-to-roll sliders fixed with new rollers, cleaned tracks and adjusted panels." },
    { "name": "Label and quote review", "short": "Quote review", "blurb": "Bring any window quote and we explain each rating on it, line by line." }
  ],
  "proof": {
    "label": "Sample",
    "rating": 4.8,
    "reviewCount": 241,
    "reviews": [
      { "text": "Victor walked me through the label on a sample window: DP, missile level, U-factor, SHGC. I had two other quotes and finally understood why the prices were different.", "name": "Ellen R.", "town": "Pelican Bay", "service": "Label and quote review", "stars": 5 },
      { "text": "Fifteen years of putting up panels every storm. They showed us the cost of keeping the shutters next to the cost of impact glass, without pushing. We went with glass this spring.", "name": "Robert J.", "town": "North Naples", "service": "Shutter to impact glass", "stars": 5 },
      { "text": "Our condo board needed product approvals and specs for every unit. They prepared the packet, the board approved it in one meeting and the installs went floor by floor.", "name": "Sandra W.", "town": "Naples", "service": "Condo window projects", "stars": 5 },
      { "text": "The lanai slider was twelve feet wide and hard to push. They put in an impact slider rated for our wall and it rolls with one finger now.", "name": "Tom E.", "town": "Bonita Springs", "service": "Impact sliding glass doors", "stars": 5 },
      { "text": "We signed in March because they told us when to order to be done before June. Installed the first week of May, inspection passed the next week.", "name": "Judy C.", "town": "Estero", "service": "Impact window replacement", "stars": 5 },
      { "text": "The slider was grinding on the track. They replaced the rollers and cleaned the track in an hour. They said we did not need a new door yet.", "name": "Luis G.", "town": "Golden Gate", "service": "Slider rollers and tracks", "stars": 5 },
      { "text": "New impact French doors to the pool. The locks close at three points and the sill stayed dry in the August rain. Took a little longer than planned to arrive.", "name": "Kathy N.", "town": "Marco Island", "service": "Impact French doors", "stars": 4 }
    ],
    "guarantee": "Every product we quote comes with its label numbers in writing. If a number changes, so does your price.",
    "license": "SAMPLE-FL-CGC-0144",
    "insured": true,
    "years": 12,
    "prices": [
      { "item": "Impact window", "from": "$1,300", "to": "$2,800", "unit": "per opening", "note": "installed, size and rating change it" },
      { "item": "Impact sliding glass door", "from": "$5,500", "to": "$12,000", "unit": "installed", "note": "width, panels and pressure rating" },
      { "item": "Impact French doors", "from": "$6,000", "to": "$11,000", "unit": "per pair", "note": "installed with multi-point locks" },
      { "item": "Slider rollers and track", "from": "$200", "to": "$450", "unit": "per door", "note": "when the panels are sound" }
    ]
  },
  "seo": {
    "title": "Impact Windows & Sliders in Naples, FL | Shutterless W&D",
    "description": "Naples impact windows and sliders with every label number explained: design pressure, missile level, U-factor, SHGC. Order-by dates for storm season."
  },
  "demo": {
    "disclaimer": "Sample website by Site Sledge. Business details are illustrative."
  }
}
