{
  "id": "gutter-C",
  "trade": "gutter",
  "direction": "C",
  "biz": {
    "name": "Firneedle Gutter Co.",
    "short": "Firneedle",
    "initials": "FG",
    "slug": "firneedle-gutter",
    "owner": "Corey A.",
    "tradeLabel": "Gutters",
    "schemaType": "HomeAndConstructionBusiness",
    "phone": "(503) 555-0115",
    "phoneE164": "+15035550115",
    "sms": true,
    "email": "hello@firneedle-gutter.example",
    "city": "Portland",
    "state": "OR",
    "stateName": "Oregon",
    "timezone": "America/Los_Angeles",
    "areas": ["Milwaukie", "Lake Oswego", "Beaverton", "Gresham", "Tigard", "West Linn"],
    "zips": ["97202", "97206", "97211", "97212", "97213", "97214", "97215", "97219", "97222", "97034", "97005", "97030", "97223", "97068"],
    "hours": {
      "mon": ["07:30", "16:30"], "tue": ["07:30", "16:30"], "wed": ["07:30", "16:30"],
      "thu": ["07:30", "16:30"], "fri": ["07:30", "16:30"], "sat": ["09:00", "13:00"], "sun": null
    },
    "emergency": false,
    "familyOwned": true
  },
  "services": [
    { "name": "Gutter cleaning", "short": "Cleaning", "blurb": "Fir needles, maple leaves and moss cleared by hand, bagged, and downspouts flushed." },
    { "name": "Cleaning plans by tree", "short": "Cleaning plans", "blurb": "Two to four visits a year, timed to when your trees actually drop." },
    { "name": "Gutter guards for fir needles", "short": "Guards", "blurb": "Fine micro-mesh that stops needles, picked after we see which trees hang over the roof." },
    { "name": "Seamless gutter replacement", "short": "Seamless gutters", "blurb": "New one-piece gutters for older Portland houses, matched to the trim color." },
    { "name": "Downspout extensions and splash blocks", "short": "Downspouts", "blurb": "Disconnected downspouts given extensions or splash blocks that carry water away from the house." },
    { "name": "Storm and ice repair", "short": "Storm repair", "blurb": "Sections pulled loose by ice or falling limbs re-hung on new hangers within days." },
    { "name": "Moss removal at the roof edge", "short": "Moss", "blurb": "Moss brushed off the lower shingles on shaded north sides so gutters stay clear longer." },
    { "name": "Fascia repair", "short": "Fascia", "blurb": "Wet fascia behind old gutters replaced and primed before the new run goes up." }
  ],
  "proof": {
    "label": "Sample",
    "rating": 4.9,
    "reviewCount": 132,
    "reviews": [
      { "text": "Three Douglas firs over our Sellwood house means needles in the gutters all year. Corey set us up with three cleanings timed to the trees and mesh on the back run. First winter with no overflow.", "name": "Jenna R.", "town": "Portland", "service": "Cleaning plans by tree", "stars": 5 },
      { "text": "The January ice storm pulled the front gutter half off. They came out four days later, put in new hangers and re-hung the run. They even picked up the branches on the walk.", "name": "Doug F.", "town": "Milwaukie", "service": "Storm and ice repair", "stars": 5 },
      { "text": "Our downspouts were disconnected years ago and just dumped water on the side path. They added extensions and splash blocks that carry it out to the lawn. The path no longer floods.", "name": "Anita S.", "town": "Tigard", "service": "Downspout extensions and splash blocks", "stars": 5 },
      { "text": "The bigleaf maple fills the gutters every November. They cleaned by hand, bagged everything and flushed each downspout. They showed us a photo of the clog they pulled from the elbow.", "name": "Mike O.", "town": "Lake Oswego", "service": "Gutter cleaning", "stars": 5 },
      { "text": "We asked about guards under our firs and they recommended a fine mesh, but told us we would still need one cleaning a year. Install was clean, a little later in the season than we hoped.", "name": "Sara W.", "town": "Beaverton", "service": "Gutter guards for fir needles", "stars": 4 },
      { "text": "Moss on the north roof kept washing into the gutter. They brushed the bottom rows and cleaned the whole run on the same visit. The difference after the first rain was obvious.", "name": "Tom H.", "town": "Gresham", "service": "Moss removal at the roof edge", "stars": 5 }
    ],
    "license": "SAMPLE-OR-CCB-237104",
    "years": 9,
    "prices": [
      { "item": "Gutter cleaning", "from": "$150", "to": "$425", "note": "one or two stories, bagged and hauled" },
      { "item": "Micro-mesh gutter guards", "from": "$12", "to": "$30", "unit": "per linear ft", "note": "fine mesh for fir needles" },
      { "item": "Seamless aluminum gutters", "from": "$10", "to": "$22", "unit": "per linear ft", "note": "trim-matched colors" },
      { "item": "Downspout extension and splash block", "from": "$175", "to": "$450", "note": "per downspout" },
      { "item": "Storm repair and re-hang", "from": "$225", "to": "$900", "note": "new hangers, depends on run length" },
      { "item": "Fascia repair", "from": "$350", "to": "$1,500", "note": "depends on length of rotted board" }
    ]
  },
  "seo": {
    "title": "Portland Gutter Cleaning & Guards for Firs | Firneedle",
    "description": "Portland gutter cleaning, fir-needle guards and storm repair, timed to what your trees drop. Serving Milwaukie, Lake Oswego, Tigard and nearby."
  },
  "demo": {
    "disclaimer": "Sample website by Site Sledge. Business details are illustrative."
  }
}
