{
  "id": "carpenter-C",
  "trade": "carpenter",
  "direction": "C",
  "biz": {
    "name": "Three Porches Carpentry",
    "short": "Three Porches",
    "initials": "TP",
    "slug": "three-porches",
    "owner": "Nico V.",
    "tradeLabel": "Carpentry",
    "schemaType": "GeneralContractor",
    "phone": "(508) 555-0169",
    "phoneE164": "+15085550169",
    "sms": true,
    "email": "hello@three-porches.example",
    "city": "Worcester",
    "state": "MA",
    "stateName": "Massachusetts",
    "timezone": "America/New_York",
    "areas": ["Shrewsbury", "Auburn", "Holden", "Millbury", "Leicester", "West Boylston"],
    "zips": ["01602", "01603", "01604", "01605", "01606", "01607", "01608", "01609", "01610", "01545", "01501", "01520", "01527", "01524", "01583"],
    "hours": {
      "mon": ["07:00", "17:00"],
      "tue": ["07:00", "17:00"],
      "wed": ["07:00", "17:00"],
      "thu": ["07:00", "17:00"],
      "fri": ["07:00", "17:00"],
      "sat": ["08:00", "13:00"],
      "sun": null
    },
    "emergency": false,
    "familyOwned": false
  },
  "services": [
    { "name": "Triple-decker porch rebuilds", "short": "Porch rebuilds", "blurb": "Front or back porch stacks rebuilt floor by floor: posts, decking, rails and roof trim." },
    { "name": "Porch railings and balusters", "short": "Railings", "blurb": "Wobbly rails replaced at typical 36-inch guard height with balusters spaced under 4 inches." },
    { "name": "Back stairs and egress stairs", "short": "Back stairs", "blurb": "Rotted rear stairs rebuilt with solid stringers, even risers and a rail you can grip." },
    { "name": "Porch floors and posts", "short": "Floors & posts", "blurb": "Soft porch boards and rotted post bases swapped out before they become a hazard." },
    { "name": "Clapboard and exterior trim", "short": "Exterior trim", "blurb": "Split clapboards, corner boards and rotted window trim replaced and primed before winter." },
    { "name": "Decks and back steps", "short": "Decks", "blurb": "Small backyard decks and steps built on proper footings, sized for a grill and chairs." },
    { "name": "Apartment turnover carpentry", "short": "Turnover fixes", "blurb": "Doors, trim, closet shelves and stair treads fixed between tenants so the unit rents faster." },
    { "name": "Doors that stick or won't lock", "short": "Doors", "blurb": "Front and unit doors planed, rehung and lined up so the locks catch every time." },
    { "name": "Sheds, pergolas and fences", "short": "Outdoor builds", "blurb": "Garden sheds, pergolas and short fences framed in pressure-treated wood and cedar." },
    { "name": "Sills, joists and framing", "short": "Framing", "blurb": "Rotted porch ledgers and sagging joists sistered or replaced so the floors sit level again." }
  ],
  "proof": {
    "label": "Sample",
    "rating": 4.8,
    "reviewCount": 156,
    "reviews": [
      { "text": "I own a triple-decker on Grafton Hill and the back porches were failing on all three floors. Nico's crew rebuilt them one floor at a time so my tenants always had a way down the back. Done before the October rain.", "name": "Fatima R.", "town": "Worcester", "service": "Triple-decker porch rebuilds", "stars": 5 },
      { "text": "Second-floor railing moved when you leaned on it. They replaced the whole run, and my inspector checked the height and the baluster gaps without a single note.", "name": "Kevin D.", "town": "Worcester", "service": "Porch railings and balusters", "stars": 5 },
      { "text": "Back stairs had one tread that cracked in February. They came out, shored it up so we could use it, and rebuilt the full stair in April when the ground thawed.", "name": "Ana P.", "town": "Shrewsbury", "service": "Back stairs and egress stairs", "stars": 5 },
      { "text": "We live on the first floor and rent the other two. Turnover in June used to mean a month of calls. This year they handled doors, trim and a closet in four days and texted photos of every fix.", "name": "Joe M.", "town": "Worcester", "service": "Apartment turnover carpentry", "stars": 5 },
      { "text": "Corner boards on our Holden colonial were rotting at the bottom. Replaced, primed, and they pointed out two more spots to watch next year instead of padding the bill.", "name": "Bridget O.", "town": "Holden", "service": "Clapboard and exterior trim", "stars": 4 },
      { "text": "Porch floor on Vernon Hill was soft near the steps. Two days later it was new fir boards, painted gray, and the posts were sitting on new bases. My kids sit out there every night now.", "name": "Luis C.", "town": "Worcester", "service": "Porch floors and posts", "stars": 5 }
    ],
    "guarantee": "If a porch, rail or stair we built loosens or rots within 5 years, we come back and make it right.",
    "license": "SAMPLE-MA-48230",
    "insured": true,
    "years": 11,
    "prices": [
      { "item": "Triple-decker porch rebuild", "from": "$9,500", "to": "$22,000", "unit": "per floor", "note": "depends on size, roof and stairs" },
      { "item": "Porch railing and balusters", "from": "$75", "to": "$160", "unit": "per linear ft" },
      { "item": "Rear egress stair rebuild", "from": "$4,500", "to": "$12,000", "unit": "per flight" },
      { "item": "Porch floor boards replaced", "from": "$18", "to": "$35", "unit": "per sq ft" },
      { "item": "Exterior trim rot repair", "from": "$350", "to": "$1,200", "note": "corner boards, sills, fascia" }
    ]
  },
  "seo": {
    "title": "Triple-Decker Porch Rebuilds, Worcester, MA | Three Porches",
    "description": "Worcester porch carpentry for triple-deckers and family homes: porch rebuilds, railings, back stairs and rotted trim, floor by floor. See sample prices."
  },
  "demo": {
    "disclaimer": "Sample website by Site Sledge. Business details are illustrative."
  }
}
