{
  "id": "landclearing-C",
  "trade": "landclearing",
  "direction": "C",
  "biz": {
    "name": "Split Rail Land Clearing",
    "short": "Split Rail",
    "initials": "SR",
    "slug": "split-rail-land",
    "owner": "Hank M.",
    "tradeLabel": "Land Clearing",
    "schemaType": "HomeAndConstructionBusiness",
    "phone": "(434) 555-0118",
    "phoneE164": "+14345550118",
    "sms": false,
    "email": "hello@split-rail-land.example",
    "city": "Lynchburg",
    "state": "VA",
    "stateName": "Virginia",
    "timezone": "America/New_York",
    "areas": ["Forest", "Madison Heights", "Rustburg", "Amherst", "Bedford", "Appomattox", "Concord"],
    "zips": ["24501", "24502", "24503", "24504", "24551", "24572", "24588", "24521"],
    "hours": {
      "mon": ["07:00", "17:00"], "tue": ["07:00", "17:00"], "wed": ["07:00", "17:00"],
      "thu": ["07:00", "17:00"], "fri": ["07:00", "17:00"], "sat": null, "sun": null
    },
    "emergency": false,
    "familyOwned": true
  },
  "services": [
    { "name": "Old field and pasture reclaiming", "short": "Old fields", "blurb": "Grown-up hayfields and pastures opened back to grass, cedars and briars gone." },
    { "name": "Forestry mulching", "short": "Mulching", "blurb": "Brush and saplings mulched on steep ground where a dozer would tear the hill." },
    { "name": "Homesite clearing on sloped lots", "short": "Homesites", "blurb": "A house spot and drive cut into the hillside, with the slope kept from washing." },
    { "name": "Fence row and hedgerow clearing", "short": "Fence rows", "blurb": "Old fence rows grown into tree lines cut back so new fence can go in." },
    { "name": "Invasive plant removal", "short": "Invasives", "blurb": "Tree of heaven, autumn olive and multiflora rose cut and kept from coming back." },
    { "name": "Farm road and trail cutting", "short": "Farm roads", "blurb": "Woods roads and walking trails reopened along the contour so they hold up." },
    { "name": "Stump grinding", "short": "Stumps", "blurb": "Stumps ground out of yards and field edges so you can mow right across." },
    { "name": "Tree removal", "short": "Tree removal", "blurb": "Dead oaks, poplars and leaning pines brought down safely and cleaned up." },
    { "name": "Storm debris cleanup", "short": "Storm cleanup", "blurb": "Trees down after ice or wind cut, cleared off fences and roads, and mulched." }
  ],
  "proof": {
    "label": "Sample",
    "rating": 4.7,
    "reviewCount": 86,
    "reviews": [
      { "text": "My granddad's hayfield behind the house had gone to cedar and broomsedge since the eighties. Hank's crew brought it back over a week in October, and you can see the old terraces again.", "name": "Loretta P.", "town": "Rustburg", "service": "Old field and pasture reclaiming" },
      { "text": "Our lot in Forest drops off hard toward the creek. They mulched instead of bulldozing, left the roots holding the bank, and the driveway went in without a single washout this spring.", "name": "Gideon A.", "town": "Forest", "service": "Homesite clearing on sloped lots" },
      { "text": "Tree of heaven had taken over the whole north side of the farm. They cut it, treated the stumps, and came back in July for the sprouts. Two years on, it hasn't returned.", "name": "Winifred C.", "town": "Amherst", "service": "Invasive plant removal" },
      { "text": "Hank and his son walked the property line with me and the old survey, found the iron pins, and cleared right along it. Neighbors were happy too.", "name": "Ellis B.", "town": "Bedford", "service": "Fence row and hedgerow clearing" },
      { "text": "We lost four big poplars in the ice storm, two on the fence and one across the farm road. They had it all opened up in two days and mulched the tops where they fell.", "name": "Opal R.", "town": "Appomattox", "service": "Storm debris cleanup" },
      { "text": "Good, careful people. They reopened an old logging road on our place so we can get the truck to the back field again, and they followed the contour so it doesn't rut out.", "name": "Silas F.", "town": "Concord", "service": "Farm road and trail cutting" }
    ],
    "guarantee": "We come back within the first growing season to cut any resprouts on ground we cleared.",
    "license": "SAMPLE-VA-71418",
    "insured": true,
    "years": 22,
    "prices": [
      { "item": "Old field reclaiming", "from": "$1,100", "to": "$2,600", "unit": "per acre", "note": "cedar, briars and saplings" },
      { "item": "Forestry mulching, hardwood slope", "from": "$2,200", "to": "$4,500", "unit": "per acre", "note": "steep ground, trees up to 8 inches" },
      { "item": "Fence row clearing", "from": "$3", "to": "$7", "unit": "per foot", "note": "grown-in rows with mature trees" },
      { "item": "Invasive cut and follow-up", "from": "$600", "to": "$1,800", "note": "per patch, includes one return visit" },
      { "item": "Stump grinding", "from": "$140", "to": "$420", "unit": "per stump", "note": "by diameter and rock in the ground" }
    ]
  },
  "seo": {
    "title": "Land Clearing in Lynchburg, VA | Split Rail Land Clearing",
    "description": "Lynchburg land clearing for old fields, fence rows and sloped homesites. Mulched, not bulldozed, so the red clay stays put. Forest, Bedford, Amherst."
  },
  "demo": {
    "disclaimer": "Sample website by Site Sledge. Business details are illustrative."
  }
}
