{
  "id": "moving-A",
  "trade": "moving",
  "direction": "A",
  "biz": {
    "name": "Tag & Lift Moving",
    "short": "Tag & Lift",
    "initials": "TL",
    "slug": "tag-and-lift",
    "owner": "Andre M.",
    "tradeLabel": "Moving & Junk Removal",
    "schemaType": "MovingCompany",
    "phone": "(919) 555-0176",
    "phoneE164": "+19195550176",
    "sms": true,
    "email": "hello@tag-and-lift.example",
    "city": "Durham",
    "state": "NC",
    "stateName": "North Carolina",
    "timezone": "America/New_York",
    "areas": ["Chapel Hill", "Carrboro", "Hillsborough", "Morrisville", "Cary", "Creedmoor"],
    "zips": ["27701", "27703", "27704", "27705", "27707", "27713", "27514", "27516", "27510", "27278", "27560", "27511"],
    "hours": {
      "mon": ["07:00", "19:00"], "tue": ["07:00", "19:00"], "wed": ["07:00", "19:00"],
      "thu": ["07:00", "19:00"], "fri": ["07:00", "19:00"], "sat": ["08:00", "16:00"], "sun": null
    },
    "emergency": false,
    "familyOwned": false
  },
  "services": [
    { "name": "Local moves", "short": "Local moves", "blurb": "Apartment, townhouse or house moves across town, with every piece tagged to its new room." },
    { "name": "Packing and wrapping", "short": "Packing", "blurb": "We box the kitchen and books, pad the furniture and shrink-wrap mattresses before they leave." },
    { "name": "Furniture and heavy items", "short": "Heavy items", "blurb": "Pianos, gun safes, sleeper sofas and treadmills moved down steps on the right straps." },
    { "name": "Take apart and put back together", "short": "Assembly", "blurb": "Bed frames, cribs, desks and dining tables taken apart, bagged with their screws, rebuilt." },
    { "name": "Junk removal", "short": "Junk removal", "blurb": "Garage piles, old furniture and move-out leftovers loaded and sorted for donation or recycling." },
    { "name": "Donation drop-off", "short": "Donation runs", "blurb": "Usable furniture and boxes taken to local donation centers, with a receipt when they give one." },
    { "name": "Labor-only loading", "short": "Loading help", "blurb": "You rent the truck or container, our crew loads it tight so nothing shifts on the road." },
    { "name": "Appliance haul-away", "short": "Appliances", "blurb": "Old fridges, washers and stoves disconnected, carried out and taken to metal recycling." }
  ],
  "proof": {
    "label": "Sample",
    "rating": 4.9,
    "reviewCount": 214,
    "reviews": [
      { "text": "Moving out of a third-floor walk-up off Ninth Street in July heat. Two guys, and the third showed up at 10 when they saw the stairs. Every box had a tag and a room. I found the coffee maker in the kitchen of the new place before I found my shoes.", "name": "Priya K.", "town": "Durham", "service": "Local moves" },
      { "text": "They took apart a bunk bed I had given up on and taped the bolts to the rails in labelled bags. Put it back together in the new room in twenty minutes.", "name": "Marcus B.", "town": "Carrboro", "service": "Take apart and put back together" },
      { "text": "Our upright piano had to come down five brick porch steps. They laid boards, strapped it to a board dolly and walked it down slowly while one of them called out each step. Not a scratch on the steps or the piano.", "name": "Helen W.", "town": "Hillsborough", "service": "Furniture and heavy items" },
      { "text": "After closing on Dad's house we had a garage full of forty years of stuff. They set aside the tools my brother wanted, took two loads to donation and hauled the rest. Took one long morning.", "name": "Dwayne T.", "town": "Chapel Hill", "service": "Junk removal" },
      { "text": "Quoted four hours for our two-bedroom in Morrisville, took four and a half because of the elevator wait. They told us at hour three, not at the end. That's all I wanted.", "name": "Erin S.", "town": "Morrisville", "service": "Local moves" },
      { "text": "Hired them only to load a rental truck going to Ohio. They built the load like a wall, heaviest pieces to the front. Opened it in Columbus and nothing had moved.", "name": "Ben O.", "town": "Cary", "service": "Labor-only loading" }
    ],
    "guarantee": "If something we wrapped arrives damaged, we fix it or pay for the repair.",
    "license": "SAMPLE-NC-MV-2210",
    "insured": true,
    "years": 9,
    "prices": [
      { "item": "Two movers and a truck", "from": "$129", "to": "$159", "unit": "per hour", "note": "2-hour minimum, local moves" },
      { "item": "Three movers and a truck", "from": "$169", "to": "$209", "unit": "per hour", "note": "most 3-bedroom homes" },
      { "item": "Packing help", "from": "$45", "to": "$60", "unit": "per packer per hour", "note": "materials billed as used" },
      { "item": "Junk haul, quarter truck", "from": "$175", "to": "$275", "note": "about a pickup truck bed and a half" },
      { "item": "Single item pickup", "from": "$85", "to": "$150", "note": "one couch, mattress or appliance" }
    ]
  },
  "seo": {
    "title": "Movers & Junk Removal in Durham, NC | Tag & Lift Moving",
    "description": "Durham local moves and junk removal. Every piece tagged to its new room, furniture padded and junk sorted for donation first. Price your move online."
  },
  "demo": {
    "disclaimer": "Sample website by Site Sledge. Business details are illustrative."
  }
}
